{
  "schema_version": 1,
  "created_at": "2026-05-27T21:45:00+07:00",
  "updated_at": "2026-05-27T22:10:00+07:00",
  "last_actor": "codex",
  "mode": "solo",
  "status": "paused",
  "outcome": "none",
  "phase": "planning",
  "feature_slug": "sample-workstream-bootstrap",
  "workstream_dir": ".mnhat/2026-05-27-sample-workstream-bootstrap",
  "current_work": {
    "tracker_type": "bd",
    "tracker_id": "skills-201",
    "title": "Bootstrap the first workstream-first MNHAT run",
    "scope": "Create locked context and a bounded planning packet for one approved slice."
  },
  "primary_artifact": ".mnhat/2026-05-27-sample-workstream-bootstrap/planning/current-story-pack.md",
  "artifact_paths": [
    ".mnhat/2026-05-27-sample-workstream-bootstrap/exploring/context.md",
    ".mnhat/2026-05-27-sample-workstream-bootstrap/implementation-record.md",
    ".mnhat/2026-05-27-sample-workstream-bootstrap/planning/current-story-pack.md",
    ".mnhat/2026-05-27-sample-workstream-bootstrap/planning/work-shape.md"
  ],
  "write_paths": [
    "skills/mnhat/references/state-contract.md",
    "skills/mnhat/references/state.schema.json"
  ],
  "completed_steps": [
    "Locked the workstream naming rule.",
    "Created the exploring context."
  ],
  "remaining_steps": [
    "Review the planning packet.",
    "Approve or revise the current work before execution."
  ],
  "resume_point": "Open current-story-pack.md first, then confirm whether the planning packet is approved for validating.",
  "resume_checks": [
    "Read AGENTS.md.",
    "Read the primary_artifact.",
    "Check git status."
  ],
  "verification_state": {
    "status": "in_progress",
    "completed_checks": [
      "Confirmed the workstream directory naming rule.",
      "Verified the planning artifact paths are workstream-first."
    ],
    "pending_checks": [
      "Validate the plan against repo truth.",
      "Get explicit execution approval."
    ]
  },
  "worktree_state": {
    "dirty": true,
    "uncommitted_paths": [
      "skills/mnhat/references/state-contract.md",
      "skills/mnhat/references/state.schema.json"
    ]
  },
  "branch": "main",
  "head_commit": "1234567890abcdef1234567890abcdef12345678",
  "active_slices": [],
  "context_notes": "Resume only after checking whether planning is still the active phase."
}
